{
  "extraction_id": "ER-SP-compass_artifact_wf-e33b0dbb-828e-4221-b8c5-7bf05bddcdba_text_markdown_normalized-018-SNP-001",
  "source_packet_id": "SP-compass_artifact_wf-e33b0dbb-828e-4221-b8c5-7bf05bddcdba_text_markdown_normalized-018",
  "source_id": "SRC-compass_artifact_wf-e33b0dbb-828e-4221-b8c5-7bf05bddcdba_text_markdown_normalized-018",
  "source_type": "help_center",
  "source_title": "Connect Your Flutterwave Account",
  "source_ref": "https://help.payhip.com/article/367-connect-your-flutterwave-account",
  "source_date_if_available": "Undated",
  "author_or_actor_if_available": null,
  "snippet_primary": "> \"Flutterwave's standard fee for online credit card transactions ranges from 2.6% - 4.8% per transaction depending on your country/region and where your customer is paying from. Fees vary by payment methods, please check Flutterwave's pricing page for the latest updates. Note that these fees are collected by Flutterwave and do not go to Payhip.\"",
  "snippet_context_before": null,
  "snippet_context_after": null,
  "traceability_pointer": {
    "pointer_type": "url",
    "pointer_value": "https://help.payhip.com/article/367-connect-your-flutterwave-account",
    "secondary_pointer": null
  },
  "claim_type": "pricing_statement",
  "subject_exact": "Payhip-documented Flutterwave gateway transaction fee range",
  "actor_level": "platform",
  "platforms": [
    "Payhip",
    "Flutterwave"
  ],
  "product_type_if_explicit": "unknown",
  "metric_type": "fee_rate",
  "metric_value_raw": "2.6% - 4.8%",
  "metric_unit": "percent",
  "time_scope_raw": "Undated",
  "time_scope_normalized_if_safe": null,
  "geography_if_explicit": null,
  "evidence_role": "official_policy",
  "local_qualifiers": [
    "fees collected by Flutterwave, not Payhip",
    "varies by country/region and customer location"
  ],
  "uncertainties": [
    "none"
  ],
  "parser_notes": []
}