{
  "extraction_id": "ER-SP-compass_artifact_wf-394dae4a-6a0d-4d19-af44-9adf808718dc_text_markdown-008-SNP-001",
  "source_packet_id": "SP-compass_artifact_wf-394dae4a-6a0d-4d19-af44-9adf808718dc_text_markdown-008",
  "source_id": "SRC-compass_artifact_wf-394dae4a-6a0d-4d19-af44-9adf808718dc_text_markdown-008",
  "source_type": "article",
  "source_title": "Hotmart Get Rich Without Going Viral",
  "source_ref": "https://restofworld.org/2023/hotmart-get-rich-without-going-viral",
  "source_date_if_available": "June 19, 2023",
  "author_or_actor_if_available": null,
  "snippet_primary": "\"Before joining Hotmart, Martínez, the car repair creator, hadn't been able to charge clients outside of his native market of Costa Rica. Although many were willing to pay his $20 monthly subscription fee, they couldn't find a way around PayPal's geographic payment restrictions.\"",
  "snippet_context_before": null,
  "snippet_context_after": null,
  "traceability_pointer": {
    "pointer_type": "url",
    "pointer_value": "https://restofworld.org/2023/hotmart-get-rich-without-going-viral",
    "secondary_pointer": null
  },
  "claim_type": "anecdotal_report",
  "subject_exact": "reported inability of a Costa Rica-based creator to charge international clients via PayPal prior to joining Hotmart",
  "actor_level": "source",
  "platforms": [
    "Hotmart",
    "PayPal"
  ],
  "product_type_if_explicit": "unknown",
  "metric_type": "payment_method_availability",
  "metric_value_raw": "$20",
  "metric_unit": "USD",
  "time_scope_raw": "monthly",
  "time_scope_normalized_if_safe": null,
  "geography_if_explicit": "Costa Rica",
  "evidence_role": "reported_event",
  "local_qualifiers": [
    "couldn't find a way around PayPal's geographic payment restrictions"
  ],
  "uncertainties": [
    "anecdotal_single_source"
  ],
  "parser_notes": []
}