{
  "extraction_id": "ER-SP-compass_artifact_wf-22c5fbd5-9e04-4d5a-9b0e-4cb97acec9cc_text_markdown_normalized-018-SNP-001",
  "source_packet_id": "SP-compass_artifact_wf-22c5fbd5-9e04-4d5a-9b0e-4cb97acec9cc_text_markdown_normalized-018",
  "source_id": "SRC-compass_artifact_wf-22c5fbd5-9e04-4d5a-9b0e-4cb97acec9cc_text_markdown_normalized-018",
  "source_type": "blog",
  "source_title": "Behind The Scenes The Making Of An Online Course With Domestika",
  "source_ref": "https://www.sketchlikeanarchitect.com/blog/behind-the-scenes-the-making-of-an-online-course-with-domestika",
  "source_date_if_available": "August 29, 2022",
  "author_or_actor_if_available": null,
  "snippet_primary": "\"Of course, I'm not allowed to discuss any exact amounts, but I can tell that there are 3 types of payments that teachers can be eligible for (as of the beginning of 2022): Advance fee: Usually, within a month from the production phase being over, teachers get paid the advance fee that were agreed on in the beginning when discussing the contract. Once the course is published and students start enrolling, teachers are basically earning back their advance fee. Royalties: Once the course earns the amount of the advance, teachers start to get paid royalties from any new enrollments. Affiliates: Some teachers are eligible to become Domestika affiliate partners.\"",
  "snippet_context_before": null,
  "snippet_context_after": null,
  "claim_type": "explicit_claim",
  "subject_exact": "Behind The Scenes The Making Of An Online Course With Domestika (blog)",
  "actor_level": "seller",
  "platforms": [
    "Domestika"
  ],
  "product_type_if_explicit": "unknown",
  "metric_type": "unknown",
  "metric_value_raw": null,
  "metric_unit": null,
  "time_scope_raw": "August 29, 2022",
  "time_scope_normalized_if_safe": "2022-08-29",
  "geography_if_explicit": null,
  "evidence_role": "direct_claim",
  "local_qualifiers": [],
  "uncertainties": [],
  "parser_notes": [
    "bulk_extract_script: heuristic rules applied; verify subject_exact and claim_type for quality"
  ],
  "traceability_pointer": {
    "pointer_type": "url",
    "pointer_value": "https://www.sketchlikeanarchitect.com/blog/behind-the-scenes-the-making-of-an-online-course-with-domestika",
    "secondary_pointer": null
  }
}