{
  "extraction_id": "ER-SP-compass_artifact_wf-a69c4eb8-8715-4dec-b187-135b1b0fa31a_text_markdown-004-SNP-001",
  "source_packet_id": "SP-compass_artifact_wf-a69c4eb8-8715-4dec-b187-135b1b0fa31a_text_markdown-004",
  "source_id": "SRC-compass_artifact_wf-a69c4eb8-8715-4dec-b187-135b1b0fa31a_text_markdown-004",
  "source_type": "blog",
  "source_title": "Patreon Creators Heres How To Stop Apple From Keeping 30 Fee 0Ffe63Aaae1F",
  "source_ref": "https://medium.com/@sakalakis/patreon-creators-heres-how-to-stop-apple-from-keeping-30-fee-0ffe63aaae1f",
  "source_date_if_available": "January 29, 2026",
  "author_or_actor_if_available": null,
  "snippet_primary": "\"If you're a Patreon creator and you've seen the recent news about Apple forcing Patreon to use in-app purchases on iOS, you probably had the same reaction everyone else did: 'Wait… does Apple now take 30% of my income?' Short answer: only if you let them. Apple has told Patreon that by November 2026, subscriptions sold inside the iOS app must use Apple's In-App Purchase system. Their system keeps 30% of the subscription price or 15% after one year of recurring subscriptions.\"",
  "snippet_context_before": null,
  "snippet_context_after": null,
  "claim_type": "explicit_claim",
  "subject_exact": "reported Apple requirement that Patreon iOS in-app subscriptions use IAP by November 2026, with 30% fee (15% after one year of recurring subscription)",
  "actor_level": "source",
  "platforms": [
    "Patreon",
    "Apple"
  ],
  "product_type_if_explicit": "unknown",
  "metric_type": "fee_rate",
  "metric_value_raw": "30% of the subscription price or 15% after one year",
  "metric_unit": "percent (Apple IAP)",
  "time_scope_raw": "by November 2026",
  "time_scope_normalized_if_safe": "2026-11",
  "geography_if_explicit": null,
  "evidence_role": "comparative_commentary",
  "local_qualifiers": [
    "Short answer: only if you let them",
    "subscriptions sold inside the iOS app must use Apple's In-App Purchase system"
  ],
  "uncertainties": [
    "anecdotal_single_source"
  ],
  "parser_notes": [
    "Blog explainer summarizing reported Apple-Patreon requirements; no first-person marketplace role, assigned 'source'."
  ],
  "traceability_pointer": {
    "pointer_type": "url",
    "pointer_value": "https://medium.com/@sakalakis/patreon-creators-heres-how-to-stop-apple-from-keeping-30-fee-0ffe63aaae1f",
    "secondary_pointer": null
  }
}
