{
  "extraction_id": "ER-SP-compass_artifact_wf-345ae7ea-8655-485d-821e-f35693f6a78f_text_markdown-010-SNP-002",
  "source_packet_id": "SP-compass_artifact_wf-345ae7ea-8655-485d-821e-f35693f6a78f_text_markdown-010",
  "source_id": "SRC-compass_artifact_wf-345ae7ea-8655-485d-821e-f35693f6a78f_text_markdown-010",
  "source_type": "blog",
  "source_title": "Direct Selling Where To Start",
  "source_ref": "https://wideauthormarketing.substack.com/p/direct-selling-where-to-start",
  "source_date_if_available": "December 17, 2025",
  "author_or_actor_if_available": null,
  "snippet_primary": "\"I tried shopify and felt like I needed a PhD. I couldn't figure it out. I like the ease of Payhip, plus I don't need 67 plugins to do simple things.\"",
  "snippet_context_before": null,
  "snippet_context_after": null,
  "claim_type": "comparative_commentary",
  "subject_exact": "author-seller comparison: Shopify perceived as too complex versus Payhip's ease without plugin dependence",
  "actor_level": "seller",
  "platforms": [
    "Shopify",
    "Payhip"
  ],
  "product_type_if_explicit": "unknown",
  "metric_type": "unknown",
  "metric_value_raw": null,
  "metric_unit": null,
  "time_scope_raw": null,
  "time_scope_normalized_if_safe": null,
  "geography_if_explicit": null,
  "evidence_role": "seller_self_claim",
  "local_qualifiers": [
    "I couldn't figure it out",
    "plus I don't need 67 plugins to do simple things"
  ],
  "uncertainties": [
    "anecdotal_single_source"
  ],
  "parser_notes": [
    "'felt like I needed a PhD' is the seller's hyperbole, preserved in snippet only."
  ],
  "traceability_pointer": {
    "pointer_type": "url",
    "pointer_value": "https://wideauthormarketing.substack.com/p/direct-selling-where-to-start",
    "secondary_pointer": null
  }
}
