{
  "extraction_id": "ER-SP-compass_artifact_wf-1d3ea608-c044-4be6-97d1-5146f970457d_text_markdown-008-SNP-002",
  "source_packet_id": "SP-compass_artifact_wf-1d3ea608-c044-4be6-97d1-5146f970457d_text_markdown-008",
  "source_id": "SRC-compass_artifact_wf-1d3ea608-c044-4be6-97d1-5146f970457d_text_markdown-008",
  "source_type": "policy_page",
  "source_title": "Privacy",
  "source_ref": "https://www.domestika.org/es/privacy",
  "source_date_if_available": "10 de julio de 2024",
  "author_or_actor_if_available": null,
  "snippet_primary": "[Stated in layout: «Profesores, Afiliados y Creativos · Datos de identificación: nombre, apellido, DNI, imagen, voz, nombre de usuario en redes sociales. Datos de contacto: dirección de correo electrónico, dirección postal, número de teléfono. Datos sobre características personales: fecha de nacimiento, nacionalidad. Datos académicos y profesionales: estudios, ocupación, experiencia profesional, CV. Otros: datos de identificación fiscal, información general proporcionada por el Usuario.»]",
  "snippet_context_before": null,
  "snippet_context_after": null,
  "claim_type": "policy_statement",
  "subject_exact": "Domestika personal data collected from teachers, affiliates, and creatives including tax identification data",
  "actor_level": "seller",
  "platforms": ["Domestika"],
  "product_type_if_explicit": "unknown",
  "metric_type": "unknown",
  "metric_value_raw": null,
  "metric_unit": null,
  "time_scope_raw": "10 de julio de 2024",
  "time_scope_normalized_if_safe": "2024-07-10",
  "geography_if_explicit": null,
  "evidence_role": "official_policy",
  "local_qualifiers": [],
  "uncertainties": [],
  "parser_notes": ["Privacy policy lists data categories collected from sellers/teachers/affiliates. Tax ID data ('datos de identificación fiscal') explicitly included."],
  "traceability_pointer": {
    "pointer_type": "url",
    "pointer_value": "https://www.domestika.org/es/privacy",
    "secondary_pointer": null
  }
}
