{
  "extraction_id": "ER-SP-compass_artifact_wf-7a40dcc5-be9a-4273-a3e8-0d53cab18fb3_text_markdown_normalized-015-SNP-003",
  "source_packet_id": "SP-compass_artifact_wf-7a40dcc5-be9a-4273-a3e8-0d53cab18fb3_text_markdown_normalized-015",
  "source_id": "SRC-compass_artifact_wf-7a40dcc5-be9a-4273-a3e8-0d53cab18fb3_text_markdown_normalized-015",
  "source_type": "blog",
  "source_title": "Why I Left Etsy",
  "source_ref": "https://www.thecluttery.com/blog/2025/7/29/why-i-left-etsy",
  "source_date_if_available": "August 31, 2025",
  "author_or_actor_if_available": null,
  "snippet_primary": "\"in 2025 when the USA increased their import tariffs I was effectively no longer able to sell to the USA either since customers aren't likely to buy if the postage and taxes cost more than the item itself.\"",
  "snippet_context_before": null,
  "snippet_context_after": null,
  "claim_type": "anecdotal_report",
  "subject_exact": "Why I Left Etsy: in 2025 when the USA increased their import tariffs I was effectively no longer able to...",
  "actor_level": "seller",
  "platforms": [
    "Etsy"
  ],
  "product_type_if_explicit": "unknown",
  "metric_type": "unknown",
  "metric_value_raw": null,
  "metric_unit": null,
  "time_scope_raw": "August 31, 2025",
  "time_scope_normalized_if_safe": "2025-08-31",
  "geography_if_explicit": "USA",
  "evidence_role": "direct_claim",
  "local_qualifiers": [],
  "uncertainties": [],
  "parser_notes": [
    "bulk_extract_script: heuristic rules applied; verify subject_exact and claim_type for quality"
  ],
  "traceability_pointer": {
    "pointer_type": "url",
    "pointer_value": "https://www.thecluttery.com/blog/2025/7/29/why-i-left-etsy",
    "secondary_pointer": null
  }
}