{
  "extraction_id": "ER-SP-compass_artifact_wf-4ff72059-9383-471e-a419-d446777044ad_text_markdown-005-SNP-001",
  "source_packet_id": "SP-compass_artifact_wf-4ff72059-9383-471e-a419-d446777044ad_text_markdown-005",
  "source_id": "SRC-compass_artifact_wf-4ff72059-9383-471e-a419-d446777044ad_text_markdown-005",
  "source_type": "pricing_page",
  "source_title": "Pagos",
  "source_ref": "https://www.kichink.com/pagos",
  "source_date_if_available": "Accessed April 2026; page undated",
  "author_or_actor_if_available": null,
  "snippet_primary": "\"Recuerda que la cadena te cobra una comisión de $8.00\"",
  "snippet_context_before": null,
  "snippet_context_after": null,
  "traceability_pointer": {
    "pointer_type": "url",
    "pointer_value": "https://www.kichink.com/pagos",
    "secondary_pointer": null
  },
  "claim_type": "pricing_statement",
  "subject_exact": "convenience-store-chain payment fee charged to Kichink buyers ($8 MXN)",
  "actor_level": "platform",
  "platforms": [
    "Kichink"
  ],
  "product_type_if_explicit": "unknown",
  "metric_type": "fee_rate",
  "metric_value_raw": "$8.00",
  "metric_unit": "MXN",
  "time_scope_raw": null,
  "time_scope_normalized_if_safe": null,
  "geography_if_explicit": null,
  "evidence_role": "official_policy",
  "local_qualifiers": [],
  "uncertainties": [],
  "parser_notes": [
    "fee is charged by the convenience-store chain acting as a payment collection point, disclosed on Kichink's own pricing page"
  ]
}