{
  "extraction_id": "ER-SP-compass_artifact_wf-02711d62-b64f-4287-b85f-3f3a57c9da67_text_markdown-002-SNP-002",
  "source_packet_id": "SP-compass_artifact_wf-02711d62-b64f-4287-b85f-3f3a57c9da67_text_markdown-002",
  "source_id": "SRC-compass_artifact_wf-02711d62-b64f-4287-b85f-3f3a57c9da67_text_markdown-002",
  "source_type": "article",
  "source_title": "Patreon Users",
  "source_ref": "https://backlinko.com/patreon-users",
  "source_date_if_available": "Page states \"Last updated on Feb. 25, 2026.\"",
  "author_or_actor_if_available": null,
  "snippet_primary": "\"Currently, only 31 creators on Patreon receive sponsorship from more than 20,000 paying members each. The top creator (ranked by number of paid members) on Patreon is Matt and Shane's Secret Podcast, a comedy podcast; 124,452 paid members sponsor the show.\"",
  "snippet_context_before": null,
  "snippet_context_after": null,
  "traceability_pointer": {
    "pointer_type": "url",
    "pointer_value": "https://backlinko.com/patreon-users",
    "secondary_pointer": null
  },
  "claim_type": "statistical_data",
  "subject_exact": "Paid-member count of the top-ranked Patreon creator (Matt and Shane's Secret Podcast) and count of creators exceeding 20,000 paid members, per Backlinko",
  "actor_level": "source",
  "platforms": [
    "Patreon"
  ],
  "product_type_if_explicit": "unknown",
  "metric_type": "active_buyers",
  "metric_value_raw": "124,452",
  "metric_unit": "paid members",
  "time_scope_raw": "Currently",
  "time_scope_normalized_if_safe": null,
  "geography_if_explicit": null,
  "evidence_role": "database_fact",
  "local_qualifiers": [
    "Currently"
  ],
  "uncertainties": [
    "current_vs_historical_ambiguity"
  ],
  "parser_notes": [
    "Snippet contains two figures: 31 creators with >20,000 paid members, and the top creator's paid-member count (124,452); metric_value_raw records only the headline top-creator figure.",
    "'Currently' is relative wording, not normalized per contract."
  ]
}