{
  "extraction_id": "ER-SP-domestika_d3_output-001-SNP-006",
  "source_packet_id": "SP-domestika_d3_output-001",
  "source_id": "SRC-domestika_d3_output-001",
  "source_type": "product_listing",
  "source_title": "Courses",
  "source_ref": "https://www.domestika.org/es/courses",
  "source_date_if_available": "Accessed April 2026; page undated",
  "author_or_actor_if_available": null,
  "snippet_primary": "\"Este precio tiene las horas contadas... 00h:00m:00s 00 horas • 00 mins • 00 segs\"",
  "snippet_context_before": null,
  "snippet_context_after": null,
  "claim_type": "availability_statement",
  "subject_exact": "Courses: Este precio tiene las horas contadas...",
  "actor_level": "source",
  "platforms": [
    "Domestika"
  ],
  "product_type_if_explicit": "unknown",
  "metric_type": "unknown",
  "metric_value_raw": null,
  "metric_unit": null,
  "time_scope_raw": "April 2026",
  "time_scope_normalized_if_safe": "2026-04",
  "geography_if_explicit": null,
  "evidence_role": "direct_claim",
  "local_qualifiers": [],
  "uncertainties": [
    "source_date_unclear"
  ],
  "parser_notes": [
    "bulk_extract_script: heuristic rules applied; verify subject_exact and claim_type for quality"
  ],
  "traceability_pointer": {
    "pointer_type": "url",
    "pointer_value": "https://www.domestika.org/es/courses",
    "secondary_pointer": null
  }
}