{
  "extraction_id": "ER-SP-compass_artifact_wf-a943ee9d-6e80-4080-a978-da2156eaae41_text_markdown-018-SNP-004",
  "source_packet_id": "SP-compass_artifact_wf-a943ee9d-6e80-4080-a978-da2156eaae41_text_markdown-018",
  "source_id": "SRC-compass_artifact_wf-a943ee9d-6e80-4080-a978-da2156eaae41_text_markdown-018",
  "source_type": "buyer_review",
  "source_title": "Review",
  "source_ref": "https://www.trustpilot.com/review/www.etsy.com",
  "source_date_if_available": "Accessed April 2026",
  "author_or_actor_if_available": null,
  "snippet_primary": "\"I purchased items from a seller that were delivered well beyond the expected delivery time. When they arrived they were damaged due to poor packaging. I contacted seller who said they would refund and then they ghosted me. I got Etsy involved and Etsy cancelled the order and refunded me but also covered the sellers cost. Now I am unable to leave a review on the sellers account? Even though I went three months waiting for this item that was for a wedding. I think that is crazy that future buyers won't be able to see accurate reviews on the seller\"",
  "snippet_context_before": null,
  "snippet_context_after": null,
  "claim_type": "review_statement",
  "subject_exact": "Review: I purchased items from a seller that were delivered well beyond the expected delivery t...",
  "actor_level": "seller",
  "platforms": [
    "Etsy",
    "Trustpilot"
  ],
  "product_type_if_explicit": "unknown",
  "metric_type": "unknown",
  "metric_value_raw": null,
  "metric_unit": null,
  "time_scope_raw": "April 2026",
  "time_scope_normalized_if_safe": "2026-04",
  "geography_if_explicit": null,
  "evidence_role": "anecdotal_example",
  "local_qualifiers": [],
  "uncertainties": [
    "time_scope_unclear"
  ],
  "parser_notes": [
    "bulk_extract_script: heuristic rules applied; verify subject_exact and claim_type for quality"
  ],
  "traceability_pointer": {
    "pointer_type": "url",
    "pointer_value": "https://www.trustpilot.com/review/www.etsy.com",
    "secondary_pointer": null
  }
}