{
  "extraction_id": "ER-SP-DG_Gumroad_D2_Platform_Mechanics-002-SNP-006",
  "source_packet_id": "SP-DG_Gumroad_D2_Platform_Mechanics-002",
  "source_id": "SRC-DG_Gumroad_D2_Platform_Mechanics-002",
  "source_type": "pricing_page",
  "source_title": "Gumroad Pricing",
  "source_ref": "https://gumroad.com/pricing",
  "source_date_if_available": "Accessed April 2026; page undated",
  "author_or_actor_if_available": null,
  "snippet_primary": "\"Digital products, e-books, courses, tutorials, and memberships—almost anything! Creators in just about every industry use (and love) Gumroad, from digital artists, writers, musicians and other creative-types to business-minded entrepreneurs and tech gurus like our SaaS creators. A better question is, 'What can't I sell on Gumroad?'\"",
  "snippet_context_before": null,
  "snippet_context_after": null,
  "claim_type": "explicit_claim",
  "subject_exact": "Gumroad product type breadth claim covering digital products, e-books, courses, tutorials, memberships",
  "actor_level": "marketplace",
  "platforms": ["Gumroad"],
  "product_type_if_explicit": ["ebook", "unknown"],
  "metric_type": "unknown",
  "metric_value_raw": null,
  "metric_unit": null,
  "time_scope_raw": null,
  "time_scope_normalized_if_safe": null,
  "geography_if_explicit": null,
  "evidence_role": "observed_platform_state",
  "local_qualifiers": ["almost anything"],
  "uncertainties": ["product_type_unclear"],
  "parser_notes": ["Snippet lists product types as examples, not exhaustive. 'e-books' maps to ebook in schema. 'courses', 'tutorials', 'memberships' do not map cleanly to schema enum. 'almost anything' qualifier preserved."],
  "traceability_pointer": {
    "pointer_type": "url",
    "pointer_value": "https://gumroad.com/pricing",
    "secondary_pointer": null
  }
}
