{
  "extraction_id": "ER-SP-compass_artifact_wf-a943ee9d-6e80-4080-a978-da2156eaae41_text_markdown-020-SNP-001",
  "source_packet_id": "SP-compass_artifact_wf-a943ee9d-6e80-4080-a978-da2156eaae41_text_markdown-020",
  "source_id": "SRC-compass_artifact_wf-a943ee9d-6e80-4080-a978-da2156eaae41_text_markdown-020",
  "source_type": "report",
  "source_title": "Etsy Statistics",
  "source_ref": "https://www.yaguara.co/etsy-statistics",
  "source_date_if_available": "Accessed April 2026; page undated",
  "author_or_actor_if_available": null,
  "snippet_primary": "\"In November 2025, Etsy saw 454.6 million visitors.\"",
  "snippet_context_before": null,
  "snippet_context_after": null,
  "claim_type": "explicit_claim",
  "subject_exact": "Etsy Statistics: In November 2025, Etsy saw 454.6 million visitors.",
  "actor_level": "marketplace",
  "platforms": [
    "Etsy"
  ],
  "product_type_if_explicit": "unknown",
  "metric_type": "unknown",
  "metric_value_raw": null,
  "metric_unit": null,
  "time_scope_raw": "November 2025",
  "time_scope_normalized_if_safe": "2025-11",
  "geography_if_explicit": null,
  "evidence_role": "direct_claim",
  "local_qualifiers": [],
  "uncertainties": [
    "source_date_unclear"
  ],
  "parser_notes": [
    "bulk_extract_script: heuristic rules applied; verify subject_exact and claim_type for quality"
  ],
  "traceability_pointer": {
    "pointer_type": "url",
    "pointer_value": "https://www.yaguara.co/etsy-statistics",
    "secondary_pointer": null
  }
}