{
  "product_type_if_explicit": "unknown",
  "snippet_context_before": null,
  "time_scope_raw": "July 10, 2025 (complaint filed); charges on May 8 and June 5, 2025",
  "evidence_role": "reported_event",
  "traceability_pointer": {
    "pointer_type": "url",
    "pointer_value": "https://www.bbb.org/us/ca/san-francisco/profile/ecommerce/gumroad-1116-448858/complaints",
    "secondary_pointer": null
  },
  "metric_unit": null,
  "source_type": "unknown",
  "time_scope_normalized_if_safe": "2025-07-10",
  "geography_if_explicit": null,
  "metric_value_raw": null,
  "source_title": "Complaints",
  "extraction_id": "ER-SP-compass_artifact_wf-fbf25436-287d-411c-be97-ee28c335a4a4_text_markdown-003-SNP-003",
  "parser_notes": [],
  "platforms": [
    "Gumroad"
  ],
  "source_date_if_available": "July 10, 2025 (complaint filed); charges on May 8 and June 5, 2025",
  "local_qualifiers": [],
  "subject_exact": "buyer complaint of unresolved duplicate charge on Gumroad (BBB filing)",
  "source_packet_id": "SP-compass_artifact_wf-fbf25436-287d-411c-be97-ee28c335a4a4_text_markdown-003",
  "actor_level": "buyer",
  "snippet_primary": "\"I was charged twice for the same digital product once on May 8, 2025, and again on June 5, 2025. I contacted Gumroad Support immediately. On June 5, Gumroad Support confirmed the duplicate purchase and said the case would be escalated for review. On June 13, they replied again saying it was still under review. However, since then, I have received no further communication, and no refund has been issued.\"",
  "source_id": "SRC-compass_artifact_wf-fbf25436-287d-411c-be97-ee28c335a4a4_text_markdown-003",
  "source_ref": "https://www.bbb.org/us/ca/san-francisco/profile/ecommerce/gumroad-1116-448858/complaints",
  "author_or_actor_if_available": null,
  "snippet_context_after": null,
  "uncertainties": [
    "anecdotal_single_source"
  ],
  "claim_type": "anecdotal_report",
  "metric_type": "unknown"
}