{
  "extraction_id": "ER-SP-compass_artifact_wf-c92310c3-4f07-4a0e-a5e2-fc02f299ab79_text_markdown-002-SNP-001",
  "source_packet_id": "SP-compass_artifact_wf-c92310c3-4f07-4a0e-a5e2-fc02f299ab79_text_markdown-002",
  "source_id": "SRC-compass_artifact_wf-c92310c3-4f07-4a0e-a5e2-fc02f299ab79_text_markdown-002",
  "source_type": "help_center",
  "source_title": "How Can I Download The Invoice For My Purchase",
  "source_ref": "https://support.domestika.org/hc/en-us/articles/360003164078-How-can-I-download-the-invoice-for-my-purchase",
  "source_date_if_available": "Accessed April 2026; page undated",
  "author_or_actor_if_available": null,
  "snippet_primary": "\"We remind you that as we are a company based in the United States, all charges are processed in dollars and invoices are issued without taxes because we do not charge them.\"",
  "snippet_context_before": null,
  "snippet_context_after": null,
  "traceability_pointer": {
    "pointer_type": "url",
    "pointer_value": "https://support.domestika.org/hc/en-us/articles/360003164078-How-can-I-download-the-invoice-for-my-purchase",
    "secondary_pointer": null
  },
  "claim_type": "policy_statement",
  "subject_exact": "Domestika USD-based charge processing and tax-free invoicing due to US company registration",
  "actor_level": "platform",
  "platforms": [
    "Domestika"
  ],
  "product_type_if_explicit": "unknown",
  "metric_type": "unknown",
  "metric_value_raw": null,
  "metric_unit": null,
  "time_scope_raw": "Accessed April 2026; page undated",
  "time_scope_normalized_if_safe": null,
  "geography_if_explicit": "United States",
  "evidence_role": "official_policy",
  "local_qualifiers": [],
  "uncertainties": [
    "none"
  ],
  "parser_notes": [
    "Geography recorded as explicit: snippet states the company is 'based in the United States' as the reason invoices exclude taxes."
  ]
}