{
  "extraction_id": "ER-SP-compass_artifact_wf-80dc1a5e-cdb7-4f06-a0fb-62209a2ddd08_text_markdown-006-SNP-001",
  "source_packet_id": "SP-compass_artifact_wf-80dc1a5e-cdb7-4f06-a0fb-62209a2ddd08_text_markdown-006",
  "source_id": "SRC-compass_artifact_wf-80dc1a5e-cdb7-4f06-a0fb-62209a2ddd08_text_markdown-006",
  "source_type": "buyer_review",
  "source_title": "Review",
  "source_ref": "https://www.trustpilot.com/review/lemonsqueezy.com",
  "source_date_if_available": "August 27, 2025",
  "author_or_actor_if_available": null,
  "snippet_primary": "\"Wanted to publish an e-book, with more than 10 customers waiting, but they are not verifying my identity for over 3 weeks now. Contacted support twice, never got a response. Horrible.\"",
  "snippet_context_before": null,
  "snippet_context_after": null,
  "claim_type": "anecdotal_report",
  "subject_exact": "seller-reported identity verification pending over 3 weeks blocking e-book launch, with unanswered support contacts (Trustpilot review of Lemon Squeezy)",
  "actor_level": "seller",
  "platforms": [],
  "product_type_if_explicit": "ebook",
  "metric_type": "unknown",
  "metric_value_raw": null,
  "metric_unit": null,
  "time_scope_raw": "for over 3 weeks now",
  "time_scope_normalized_if_safe": null,
  "geography_if_explicit": null,
  "evidence_role": "seller_self_claim",
  "local_qualifiers": [
    "with more than 10 customers waiting",
    "Contacted support twice, never got a response"
  ],
  "uncertainties": [
    "anecdotal_single_source"
  ],
  "parser_notes": [
    "Platform not named in snippet text; platforms left empty per criteria."
  ],
  "traceability_pointer": {
    "pointer_type": "url",
    "pointer_value": "https://www.trustpilot.com/review/lemonsqueezy.com",
    "secondary_pointer": null
  }
}