{
  "extraction_id": "ER-SP-compass_artifact_wf-7a40dcc5-be9a-4273-a3e8-0d53cab18fb3_text_markdown_normalized-015-SNP-001",
  "source_packet_id": "SP-compass_artifact_wf-7a40dcc5-be9a-4273-a3e8-0d53cab18fb3_text_markdown_normalized-015",
  "source_id": "SRC-compass_artifact_wf-7a40dcc5-be9a-4273-a3e8-0d53cab18fb3_text_markdown_normalized-015",
  "source_type": "blog",
  "source_title": "Why I Left Etsy",
  "source_ref": "https://www.thecluttery.com/blog/2025/7/29/why-i-left-etsy",
  "source_date_if_available": "August 31, 2025",
  "author_or_actor_if_available": null,
  "snippet_primary": "\"Etsy advertises that it takes around 3.5% commission on sales, which is of course very low. Unfortunately, that is simply not true. If you tot up all the additional fees the actual figure is closer to 15%. And that's before you've paid for postage, any marketing fees and local taxes.\"",
  "snippet_context_before": null,
  "snippet_context_after": null,
  "claim_type": "anecdotal_report",
  "subject_exact": "seller claim that Etsy's advertised ~3.5% commission understates an effective total closer to 15% once all additional fees are summed, before postage, marketing and taxes",
  "actor_level": "seller",
  "platforms": [
    "Etsy"
  ],
  "product_type_if_explicit": "unknown",
  "metric_type": "fee_rate",
  "metric_value_raw": "closer to 15%",
  "metric_unit": "percent effective (seller's calculation)",
  "time_scope_raw": null,
  "time_scope_normalized_if_safe": "2025-08-31",
  "geography_if_explicit": null,
  "evidence_role": "seller_self_claim",
  "local_qualifiers": [
    "Etsy advertises that it takes around 3.5% commission on sales",
    "If you tot up all the additional fees",
    "And that's before you've paid for postage, any marketing fees and local taxes"
  ],
  "uncertainties": [
    "anecdotal_single_source",
    "methodology_unclear"
  ],
  "parser_notes": [
    "Advertised figure in snippet: 'around 3.5% commission'; the 15% effective figure is the seller's own aggregation, method not shown.",
    "time_scope_normalized_if_safe from source_date_if_available ('August 31, 2025') per criteria G/K1."
  ],
  "traceability_pointer": {
    "pointer_type": "url",
    "pointer_value": "https://www.thecluttery.com/blog/2025/7/29/why-i-left-etsy",
    "secondary_pointer": null
  }
}
